{"$schema":"http://json-schema.org/draft-07/schema#","title":"strategy-invocation-v1","type":"object","required":["contract_version","strategy_id","strategy_version","invocation_id","market_snapshot","strategy_configuration","previous_state","execution_context"],"properties":{"contract_version":{"const":"1"},"strategy_id":{"type":"string","minLength":1},"strategy_version":{"type":"string","pattern":"^[0-9]+\\.[0-9]+\\.[0-9]+"},"invocation_id":{"type":"string","pattern":"^inv_"},"market_snapshot":{"type":"object","required":["symbol","px","ts","src"],"properties":{"symbol":{"type":"string"},"px":{"type":"string"},"ts":{"type":"string"},"src":{"type":"string"},"prev_px":{"type":"string"},"stale_s":{"type":"number"}}},"strategy_configuration":{"type":"object"},"previous_state":{"type":"object"},"execution_context":{"type":"object","required":["asof_ts","deadline_ms","trace_id"],"properties":{"asof_ts":{"type":"string"},"deadline_ms":{"type":"integer","maximum":500},"trace_id":{"type":"string"}}}}}